dataset,role,official_record,doi,redistribution_status,local_raw_path,accessed_date,license_or_terms,required_manual_steps,checksum_note
Cetin et al. 2018 SPT liquefaction dataset,SPT triggering case histories,Data in Brief article and supplementary files,10.1016/j.dib.2018.08.043,not redistributed; download from publisher,code/data/raw/cetin2018_spt/,2026-06-08,see publisher record,download supplementary XLS files and place under local_raw_path,raw checksum not published in this package
Geyin and Maurer 2021 CPT liquefaction dataset,CPT manifestation case histories,DesignSafe-CI project record,10.17603/ds2-wftt-mv37,not redistributed; download from DesignSafe,code/data/raw/geyin_maurer_2021_cpt/,2026-06-08,see DesignSafe project terms,download GLOBALDATASETV1.mat and metadata to local_raw_path,upstream manifest available after download
Rateria Geyin and Maurer 2024 CPT liquefaction dataset,current global CPT manifestation validation release,DesignSafe-CI project PRJ-5746,10.17603/ds2-8hvd-hd43,not redistributed; download from DesignSafe,code/data/raw/rateria_geyin_maurer_2024_cpt/,2026-06-08,Open Data Commons Attribution in DesignSafe metadata,download GLOBALDATASET.mat and ReadMe.pdf to local_raw_path,SOURCE.md records local manifest and SHA-512 when downloaded
Rasanen Geyin and Maurer 2022 Nisqually CPT dataset,fixed leave-Nisqually-out event caveat,DesignSafe-CI project PRJ-3758,10.17603/ds2-nsf8-7944,not redistributed; download from DesignSafe,code/data/raw/rasanen_geyin_maurer_2022_nisqually_cpt/,2026-06-08,Creative Commons Attribution in DesignSafe metadata,download 24 case spreadsheets plus Summary Table S1 and Quick ReadME,SOURCE.md records local manifest and SHA-512 when downloaded
Borja White Liu Wu 2012 slope case,slope vignette CB1 failure and stable states,International Journal for Numerical and Analytical Methods in Geomechanics article,10.1002/nag.1021,not redistributed; cite DOI and source registry,P2_closedform_inequality/data/raw/refs/,2026-06-09,see publisher terms,used only through derived non-sensitive slope-vignette rows in code/data/processed/slope_vignette_r12.csv,derived rows are traceability checks not raw source redistribution
Reid LaHusen Iverson 1997 USGS flume,slope vignette flume failures and domain control,USGS Publications Warehouse record,,not redistributed; cite USGS record and ISBN 0-7844-0268-X,P2_closedform_inequality/data/raw/refs/reid_iverson_flume_initiation_pub2398.pdf,2026-06-09,see USGS record and publication terms,used only through derived non-sensitive slope-vignette rows in code/data/processed/slope_vignette_r12.csv,local PDF not redistributed in public package
Corbett Collins Brien Lu Wayllace 2025 BALT data,slope vignette stable monitoring controls,USGS data release,10.5066/P13T8KQH,not redistributed here; official USGS data release should be used for raw files,P2_closedform_inequality/data/raw/sfbay_balt/,2026-06-09,USGS data release terms,used only through derived non-sensitive slope-vignette rows in code/data/processed/slope_vignette_r12.csv,ScienceBase item 66ccb50c recorded in root source registry
Boulanger and Idriss 2014 report,mechanistic triggering procedure,UC Davis Center for Geotechnical Modeling report URL,,not redistributed; cite official report,external/reference_only/,2026-06-08,see report/publisher terms,download separately if needed for reference checking,reference-only source
